{"$schema":"https://json-schema.org/draft/2020-12/schema","$id":"https://kaveep.dev/dev-agent/schemas/sandbox-request.schema.json","title":"KAVEEP DEV-AGENT Sandbox Request","type":"object","required":["sandboxRequestId","schemaVersion","requestRef","planRef","contextRef","gateResultRef","sourceRepositoryRoot","requestedWorkspaceMode","selectedPaths","excludedPaths","resourceLimits","preserveOriginalState","cleanupPolicy","evidenceRefs","auditRefs","status","createdAt"],"properties":{"sandboxRequestId":{"type":"string","pattern":"^sandbox_request_[A-Za-z0-9][A-Za-z0-9_-]*$"},"schemaVersion":{"type":"string","pattern":"^[0-9]+\\.[0-9]+\\.[0-9]+$"},"requestRef":{"type":"string","pattern":"^request_[A-Za-z0-9][A-Za-z0-9_-]*$"},"planRef":{"type":"string","pattern":"^plan_[A-Za-z0-9][A-Za-z0-9_-]*$"},"contextRef":{"type":"string","pattern":"^context_[A-Za-z0-9][A-Za-z0-9_-]*$"},"gateResultRef":{"type":"string","pattern":"^gate_result_[A-Za-z0-9][A-Za-z0-9_-]*$"},"sourceRepositoryRoot":{"type":"string","minLength":1},"requestedWorkspaceMode":{"type":"string","enum":["selected_context_copy","bounded_repository_copy"]},"selectedPaths":{"type":"array","items":{"type":"string","minLength":1}},"excludedPaths":{"type":"array","items":{"type":"string","minLength":1}},"resourceLimits":{"$ref":"#/$defs/resourceLimits"},"preserveOriginalState":{"type":"boolean","const":true},"cleanupPolicy":{"type":"string","enum":["explicit"]},"evidenceRefs":{"type":"array","items":{"$ref":"../../KAVEEP-CORE/schemas/evidence-ref.schema.json"}},"auditRefs":{"type":"array","items":{"$ref":"../../KAVEEP-CORE/schemas/audit-ref.schema.json"}},"status":{"type":"string","enum":["proposed","blocked","no_action","unverified"]},"createdAt":{"type":"string","format":"date-time"}},"$defs":{"resourceLimits":{"type":"object","required":["maxFiles","maxDirectories","maxTotalBytes","maxSingleFileBytes","maxDepth","maxPathLength","maxLifetimeSeconds"],"properties":{"maxFiles":{"type":"integer","minimum":1,"maximum":10000},"maxDirectories":{"type":"integer","minimum":1,"maximum":2000},"maxTotalBytes":{"type":"integer","minimum":1,"maximum":1073741824},"maxSingleFileBytes":{"type":"integer","minimum":1,"maximum":104857600},"maxDepth":{"type":"integer","minimum":0,"maximum":32},"maxPathLength":{"type":"integer","minimum":1,"maximum":4096},"maxLifetimeSeconds":{"type":"integer","minimum":1,"maximum":86400}},"additionalProperties":false}},"additionalProperties":false}
