{"sandboxRequestId":"sandbox_request_example_001","schemaVersion":"1.0.0","requestRef":"request_sandbox_example_001","planRef":"plan_sandbox_example_001","contextRef":"context_sandbox_example_001","gateResultRef":"gate_result_sandbox_example_001","sourceRepositoryRoot":"C:/work/KAVEEP-DEV-AGENT","requestedWorkspaceMode":"selected_context_copy","selectedPaths":["README.md","src"],"excludedPaths":["src/private"],"resourceLimits":{"maxFiles":200,"maxDirectories":80,"maxTotalBytes":10485760,"maxSingleFileBytes":1048576,"maxDepth":8,"maxPathLength":512,"maxLifetimeSeconds":3600},"preserveOriginalState":true,"cleanupPolicy":"explicit","evidenceRefs":[{"evidenceId":"evidence_sandbox_request_001","evidenceType":"sandbox_request","verificationStatus":"verified","sourceType":"human_input","createdAt":"1970-01-01T00:00:00.000Z","summary":"Explicit bounded sandbox preparation request."}],"auditRefs":[],"status":"proposed","createdAt":"1970-01-01T00:00:00.000Z"}
